{
  "schema_version": "0.2-candidate",
  "kind": "OLEANDER_ENTERPRISE_KERNEL",
  "candidate_status": "EVAL_ONLY",
  "generated_at": "2026-09-22T17:45:00+08:00",
  "source_projection_ref": "00-governance/runtime/erp-candidate/phase2-real-case-stress-20260922/output/fallingwater_phase2_projection_v0.3.1.json",
  "source_projection_digest": {
    "sha256": "C7A2102DEC40CAE83F253A7DA130A95C74988755ABF3697DE1133708405A3DC4",
    "hash_semantics": "UTF8_TEXT_LF_CANONICAL_V1"
  },
  "authority_boundary": {
    "kernel_is_authority": false,
    "may_mutate_current": false,
    "identity_rule": "CANONICAL_REFS_ONLY_NO_AUTHORITY_SYNTHESIS",
    "state_rule": "ORTHOGONAL_STATE_FACTS_NO_FLATTENING",
    "relation_rule": "SOURCE_BOUND_RELATIONS_NO_AUTHORITY_TRANSFER"
  },
  "identities": [
    {
      "identity_id": "KID-00-GOVERNANCE-RUNTIME-ERP-CANDIDATE-PHASE2-REAL-CASE-STRESS-20260922-OUTPUT-FALLINGWATER-PHASE2-PROJECTION-V0-3-1-JSON",
      "identity_class": "OTHER",
      "canonical_ref": "00-governance/runtime/erp-candidate/phase2-real-case-stress-20260922/output/fallingwater_phase2_projection_v0.3.1.json",
      "source_refs": [
        "00-governance/runtime/erp-candidate/phase2-real-case-stress-20260922/output/fallingwater_phase2_projection_v0.3.1.json"
      ],
      "projection_only": true
    },
    {
      "identity_id": "KID-ARTIFACT-FW-V06-NATIVE-BLEND",
      "identity_class": "ARTIFACT",
      "canonical_ref": "ARTIFACT-FW-V06-NATIVE-BLEND",
      "source_refs": [
        "00-governance/runtime/erp-candidate/phase2-real-case-stress-20260922/output/fallingwater_phase2_projection_v0.3.1.json"
      ],
      "projection_only": true
    },
    {
      "identity_id": "KID-BASELINE-FW-V06-NATIVE",
      "identity_class": "OTHER",
      "canonical_ref": "BASELINE-FW-V06-NATIVE",
      "source_refs": [
        "EV3SRC:FW:NATIVE_INTEGRITY",
        "EV3SRC:FW:FURNITURE",
        "EV3SRC:FW:ARCH_TARGETS",
        "EV3SRC:FW:CONNECTIONS",
        "EV3SRC:FW:NATIVE_BLEND"
      ],
      "projection_only": true
    },
    {
      "identity_id": "KID-D--DESGIN--MCP-RUNTIME-DIAGNOSTICS-FALLINGWATER-HABS-COMPLEX-V06-ARCH-SPATIAL-CONSTRUCTIVE-20260913-BLEND",
      "identity_class": "RESOURCE",
      "canonical_ref": "D:\\Desgin\\.mcp-runtime\\diagnostics\\FALLINGWATER_HABS_COMPLEX_V06_ARCH_SPATIAL_CONSTRUCTIVE_20260913.blend",
      "source_refs": [
        "EV3SRC:FW:NATIVE_INTEGRITY",
        "EV3SRC:FW:FURNITURE",
        "EV3SRC:FW:ARCH_TARGETS",
        "EV3SRC:FW:CONNECTIONS",
        "EV3SRC:FW:NATIVE_BLEND"
      ],
      "projection_only": true
    },
    {
      "identity_id": "KID-EV3-FW-SOURCE-MANIFEST",
      "identity_class": "OTHER",
      "canonical_ref": "EV3:FW:SOURCE_MANIFEST",
      "source_refs": [
        "00-governance/runtime/erp-candidate/phase2-real-case-stress-20260922/output/fallingwater_phase2_projection_v0.3.1.json"
      ],
      "projection_only": true
    },
    {
      "identity_id": "KID-EV3SRC-FW-ARCH-TARGETS",
      "identity_class": "EVIDENCE",
      "canonical_ref": "EV3SRC:FW:ARCH_TARGETS",
      "source_refs": [
        "EV3SRC:FW:ARCH_TARGETS",
        "EV3SRC:FW:CONNECTIONS",
        "EV3SRC:FW:FURNITURE",
        "EV3SRC:FW:NATIVE_BLEND",
        "EV3SRC:FW:NATIVE_INTEGRITY"
      ],
      "projection_only": true
    },
    {
      "identity_id": "KID-EV3SRC-FW-CONNECTIONS",
      "identity_class": "EVIDENCE",
      "canonical_ref": "EV3SRC:FW:CONNECTIONS",
      "source_refs": [
        "EV3SRC:FW:NATIVE_INTEGRITY",
        "EV3SRC:FW:FURNITURE",
        "EV3SRC:FW:ARCH_TARGETS",
        "EV3SRC:FW:CONNECTIONS",
        "EV3SRC:FW:NATIVE_BLEND"
      ],
      "projection_only": true
    },
    {
      "identity_id": "KID-EV3SRC-FW-FURNITURE",
      "identity_class": "EVIDENCE",
      "canonical_ref": "EV3SRC:FW:FURNITURE",
      "source_refs": [
        "EV3SRC:FW:NATIVE_INTEGRITY",
        "EV3SRC:FW:FURNITURE",
        "EV3SRC:FW:ARCH_TARGETS",
        "EV3SRC:FW:CONNECTIONS",
        "EV3SRC:FW:NATIVE_BLEND"
      ],
      "projection_only": true
    },
    {
      "identity_id": "KID-EV3SRC-FW-NATIVE-BLEND",
      "identity_class": "EVIDENCE",
      "canonical_ref": "EV3SRC:FW:NATIVE_BLEND",
      "source_refs": [
        "EV3SRC:FW:NATIVE_INTEGRITY",
        "EV3SRC:FW:FURNITURE",
        "EV3SRC:FW:ARCH_TARGETS",
        "EV3SRC:FW:CONNECTIONS",
        "EV3SRC:FW:NATIVE_BLEND"
      ],
      "projection_only": true
    },
    {
      "identity_id": "KID-EV3SRC-FW-NATIVE-INTEGRITY",
      "identity_class": "READBACK",
      "canonical_ref": "EV3SRC:FW:NATIVE_INTEGRITY",
      "source_refs": [
        "EV3SRC:FW:NATIVE_INTEGRITY",
        "EV3SRC:FW:FURNITURE",
        "EV3SRC:FW:ARCH_TARGETS",
        "EV3SRC:FW:CONNECTIONS",
        "EV3SRC:FW:NATIVE_BLEND"
      ],
      "projection_only": true
    },
    {
      "identity_id": "KID-FALLINGWATER-HABS-V06",
      "identity_class": "KNOWLEDGE_NODE",
      "canonical_ref": "FALLINGWATER-HABS-V06",
      "source_refs": [
        "00-governance/runtime/erp-candidate/phase2-real-case-stress-20260922/output/fallingwater_phase2_projection_v0.3.1.json",
        "EV3SRC:FW:ARCH_TARGETS",
        "EV3SRC:FW:CONNECTIONS",
        "EV3SRC:FW:FURNITURE",
        "EV3SRC:FW:NATIVE_BLEND",
        "EV3SRC:FW:NATIVE_INTEGRITY"
      ],
      "projection_only": true
    },
    {
      "identity_id": "KID-IF-FW-ENGINEERING",
      "identity_class": "INTERFACE",
      "canonical_ref": "IF-FW-ENGINEERING",
      "source_refs": [
        "EV3SRC:FW:NATIVE_INTEGRITY",
        "EV3SRC:FW:FURNITURE",
        "EV3SRC:FW:ARCH_TARGETS",
        "EV3SRC:FW:CONNECTIONS",
        "EV3SRC:FW:NATIVE_BLEND"
      ],
      "projection_only": true
    },
    {
      "identity_id": "KID-INSP-FW-ENGINEERING",
      "identity_class": "REVIEW",
      "canonical_ref": "INSP-FW-ENGINEERING",
      "source_refs": [
        "EV3SRC:FW:NATIVE_INTEGRITY",
        "EV3SRC:FW:FURNITURE",
        "EV3SRC:FW:ARCH_TARGETS",
        "EV3SRC:FW:CONNECTIONS",
        "EV3SRC:FW:NATIVE_BLEND"
      ],
      "projection_only": true
    },
    {
      "identity_id": "KID-INSP-FW-FURNITURE-USE",
      "identity_class": "REVIEW",
      "canonical_ref": "INSP-FW-FURNITURE-USE",
      "source_refs": [
        "EV3SRC:FW:NATIVE_INTEGRITY",
        "EV3SRC:FW:FURNITURE",
        "EV3SRC:FW:ARCH_TARGETS",
        "EV3SRC:FW:CONNECTIONS",
        "EV3SRC:FW:NATIVE_BLEND"
      ],
      "projection_only": true
    },
    {
      "identity_id": "KID-INSP-FW-NATIVE-INTEGRITY",
      "identity_class": "REVIEW",
      "canonical_ref": "INSP-FW-NATIVE-INTEGRITY",
      "source_refs": [
        "EV3SRC:FW:NATIVE_INTEGRITY",
        "EV3SRC:FW:FURNITURE",
        "EV3SRC:FW:ARCH_TARGETS",
        "EV3SRC:FW:CONNECTIONS",
        "EV3SRC:FW:NATIVE_BLEND"
      ],
      "projection_only": true
    },
    {
      "identity_id": "KID-KG-FW-EV3",
      "identity_class": "QUERY_POLICY",
      "canonical_ref": "KG-FW-EV3",
      "source_refs": [
        "EV3SRC:FW:NATIVE_INTEGRITY",
        "EV3SRC:FW:FURNITURE",
        "EV3SRC:FW:ARCH_TARGETS",
        "EV3SRC:FW:CONNECTIONS",
        "EV3SRC:FW:NATIVE_BLEND"
      ],
      "projection_only": true
    },
    {
      "identity_id": "KID-LOCAL-BLENDER-EXECUTION-PROVENANCE-ONLY",
      "identity_class": "OTHER",
      "canonical_ref": "LOCAL_BLENDER_EXECUTION_PROVENANCE_ONLY",
      "source_refs": [
        "EV3SRC:FW:NATIVE_INTEGRITY",
        "EV3SRC:FW:FURNITURE",
        "EV3SRC:FW:ARCH_TARGETS",
        "EV3SRC:FW:CONNECTIONS",
        "EV3SRC:FW:NATIVE_BLEND"
      ],
      "projection_only": true
    },
    {
      "identity_id": "KID-LOCAL-DIAGNOSTIC-PRODUCER",
      "identity_class": "OTHER",
      "canonical_ref": "LOCAL_DIAGNOSTIC_PRODUCER",
      "source_refs": [
        "EV3SRC:FW:NATIVE_INTEGRITY",
        "EV3SRC:FW:FURNITURE",
        "EV3SRC:FW:ARCH_TARGETS",
        "EV3SRC:FW:CONNECTIONS",
        "EV3SRC:FW:NATIVE_BLEND"
      ],
      "projection_only": true
    },
    {
      "identity_id": "KID-REQ-FW-V06-ENGINEERING-AUTHORITY",
      "identity_class": "REQUIREMENT",
      "canonical_ref": "REQ-FW-V06-ENGINEERING-AUTHORITY",
      "source_refs": [
        "00-governance/runtime/erp-candidate/phase2-real-case-stress-20260922/output/fallingwater_phase2_projection_v0.3.1.json",
        "EV3SRC:FW:ARCH_TARGETS",
        "EV3SRC:FW:CONNECTIONS",
        "EV3SRC:FW:FURNITURE",
        "EV3SRC:FW:NATIVE_BLEND",
        "EV3SRC:FW:NATIVE_INTEGRITY"
      ],
      "projection_only": true
    },
    {
      "identity_id": "KID-REVIEW-FW-V06-INDEPENDENT-DESIGN",
      "identity_class": "REVIEW",
      "canonical_ref": "REVIEW-FW-V06-INDEPENDENT-DESIGN",
      "source_refs": [
        "00-governance/runtime/erp-candidate/phase2-real-case-stress-20260922/output/fallingwater_phase2_projection_v0.3.1.json"
      ],
      "projection_only": true
    },
    {
      "identity_id": "KID-SYS-FW-V06-MODEL",
      "identity_class": "SYSTEM_ELEMENT",
      "canonical_ref": "SYS-FW-V06-MODEL",
      "source_refs": [
        "EV3SRC:FW:NATIVE_INTEGRITY",
        "EV3SRC:FW:FURNITURE",
        "EV3SRC:FW:ARCH_TARGETS",
        "EV3SRC:FW:CONNECTIONS",
        "EV3SRC:FW:NATIVE_BLEND"
      ],
      "projection_only": true
    },
    {
      "identity_id": "KID-VV-FW-ENGINEERING",
      "identity_class": "REVIEW",
      "canonical_ref": "VV-FW-ENGINEERING",
      "source_refs": [
        "EV3SRC:FW:NATIVE_INTEGRITY",
        "EV3SRC:FW:FURNITURE",
        "EV3SRC:FW:ARCH_TARGETS",
        "EV3SRC:FW:CONNECTIONS",
        "EV3SRC:FW:NATIVE_BLEND"
      ],
      "projection_only": true
    }
  ],
  "authority_bindings": [],
  "state_facts": [
    {
      "state_fact_id": "KSTATE-REVIEW-FW-V06-INDEPENDENT-DESIGN-QUALITY-REVIEW",
      "subject_ref": "REVIEW-FW-V06-INDEPENDENT-DESIGN",
      "state_family": "QUALITY",
      "state_value": "HOLD",
      "claim_scope": "REVIEW:DESIGN",
      "blocking_semantics": "EXPLICIT",
      "source_refs": [